{
  "authority": "applied",
  "contentVersion": "gem-dungeon-v2-accelerated-applied",
  "durationTicks": 150,
  "completionWindowSeconds": 15,
  "bosses": [
    {
      "bossType": "SURVIVAL",
      "stages": [
        { "stage": 1, "bossHp": 1, "bossAttack": 0, "defense": 0, "strikeDamage": 197 },
        { "stage": 2, "bossHp": 1, "bossAttack": 0, "defense": 0, "strikeDamage": 230 },
        { "stage": 3, "bossHp": 1, "bossAttack": 0, "defense": 0, "strikeDamage": 286 },
        { "stage": 4, "bossHp": 1, "bossAttack": 0, "defense": 0, "strikeDamage": 298 },
        { "stage": 5, "bossHp": 1, "bossAttack": 0, "defense": 0, "strikeDamage": 417 },
        { "stage": 6, "bossHp": 1, "bossAttack": 0, "defense": 0, "strikeDamage": 514 },
        { "stage": 7, "bossHp": 1, "bossAttack": 0, "defense": 0, "strikeDamage": 639 },
        { "stage": 8, "bossHp": 1, "bossAttack": 0, "defense": 0, "strikeDamage": 664 },
        { "stage": 9, "bossHp": 1, "bossAttack": 0, "defense": 0, "strikeDamage": 949 },
        { "stage": 10, "bossHp": 1, "bossAttack": 0, "defense": 0, "strikeDamage": 1169 }
      ]
    },
    {
      "bossType": "BERSERK",
      "stages": [
        { "stage": 1, "bossHp": 9046, "bossAttack": 0, "defense": 0, "strikeDamage": 0 },
        { "stage": 2, "bossHp": 12514, "bossAttack": 0, "defense": 0, "strikeDamage": 0 },
        { "stage": 3, "bossHp": 19390, "bossAttack": 0, "defense": 0, "strikeDamage": 0 },
        { "stage": 4, "bossHp": 21514, "bossAttack": 0, "defense": 0, "strikeDamage": 0 },
        { "stage": 5, "bossHp": 33599, "bossAttack": 0, "defense": 0, "strikeDamage": 0 },
        { "stage": 6, "bossHp": 42268, "bossAttack": 0, "defense": 0, "strikeDamage": 0 },
        { "stage": 7, "bossHp": 50808, "bossAttack": 0, "defense": 0, "strikeDamage": 0 },
        { "stage": 8, "bossHp": 56855, "bossAttack": 0, "defense": 0, "strikeDamage": 0 },
        { "stage": 9, "bossHp": 80438, "bossAttack": 0, "defense": 0, "strikeDamage": 0 },
        { "stage": 10, "bossHp": 104898, "bossAttack": 0, "defense": 0, "strikeDamage": 0 }
      ]
    },
    {
      "bossType": "ARMORED",
      "stages": [
        { "stage": 1, "bossHp": 5189, "bossAttack": 0, "defense": 171, "strikeDamage": 0 },
        { "stage": 2, "bossHp": 6794, "bossAttack": 0, "defense": 207, "strikeDamage": 0 },
        { "stage": 3, "bossHp": 10036, "bossAttack": 0, "defense": 267, "strikeDamage": 0 },
        { "stage": 4, "bossHp": 11130, "bossAttack": 0, "defense": 273, "strikeDamage": 0 },
        { "stage": 5, "bossHp": 16941, "bossAttack": 0, "defense": 381, "strikeDamage": 0 },
        { "stage": 6, "bossHp": 21215, "bossAttack": 0, "defense": 441, "strikeDamage": 0 },
        { "stage": 7, "bossHp": 25454, "bossAttack": 0, "defense": 507, "strikeDamage": 0 },
        { "stage": 8, "bossHp": 28492, "bossAttack": 0, "defense": 513, "strikeDamage": 0 },
        { "stage": 9, "bossHp": 40262, "bossAttack": 0, "defense": 621, "strikeDamage": 0 },
        { "stage": 10, "bossHp": 52508, "bossAttack": 0, "defense": 681, "strikeDamage": 0 }
      ]
    }
  ]
}
