{
  "authority": "applied",
  "contentVersion": "progression-rebalance-v1",
  "durationTicks": 150,
  "completionWindowSeconds": 15,
  "bosses": [
    {
      "bossType": "SURVIVAL",
      "stages": [
        {
          "stage": 1,
          "bossHp": 1,
          "bossAttack": 0,
          "defense": 0,
          "strikeDamage": 644
        },
        {
          "stage": 2,
          "bossHp": 1,
          "bossAttack": 0,
          "defense": 0,
          "strikeDamage": 926
        },
        {
          "stage": 3,
          "bossHp": 1,
          "bossAttack": 0,
          "defense": 0,
          "strikeDamage": 1147
        },
        {
          "stage": 4,
          "bossHp": 1,
          "bossAttack": 0,
          "defense": 0,
          "strikeDamage": 1456
        },
        {
          "stage": 5,
          "bossHp": 1,
          "bossAttack": 0,
          "defense": 0,
          "strikeDamage": 2204
        },
        {
          "stage": 6,
          "bossHp": 1,
          "bossAttack": 0,
          "defense": 0,
          "strikeDamage": 2766
        },
        {
          "stage": 7,
          "bossHp": 1,
          "bossAttack": 0,
          "defense": 0,
          "strikeDamage": 3555
        },
        {
          "stage": 8,
          "bossHp": 1,
          "bossAttack": 0,
          "defense": 0,
          "strikeDamage": 5821
        },
        {
          "stage": 9,
          "bossHp": 1,
          "bossAttack": 0,
          "defense": 0,
          "strikeDamage": 11961
        },
        {
          "stage": 10,
          "bossHp": 1,
          "bossAttack": 0,
          "defense": 0,
          "strikeDamage": 31518
        }
      ]
    },
    {
      "bossType": "BERSERK",
      "stages": [
        {
          "stage": 1,
          "bossHp": 44308,
          "bossAttack": 0,
          "defense": 0,
          "strikeDamage": 0
        },
        {
          "stage": 2,
          "bossHp": 66368,
          "bossAttack": 0,
          "defense": 0,
          "strikeDamage": 0
        },
        {
          "stage": 3,
          "bossHp": 89030,
          "bossAttack": 0,
          "defense": 0,
          "strikeDamage": 0
        },
        {
          "stage": 4,
          "bossHp": 127798,
          "bossAttack": 0,
          "defense": 0,
          "strikeDamage": 0
        },
        {
          "stage": 5,
          "bossHp": 200820,
          "bossAttack": 0,
          "defense": 0,
          "strikeDamage": 0
        },
        {
          "stage": 6,
          "bossHp": 275572,
          "bossAttack": 0,
          "defense": 0,
          "strikeDamage": 0
        },
        {
          "stage": 7,
          "bossHp": 380396,
          "bossAttack": 0,
          "defense": 0,
          "strikeDamage": 0
        },
        {
          "stage": 8,
          "bossHp": 636306,
          "bossAttack": 0,
          "defense": 0,
          "strikeDamage": 0
        },
        {
          "stage": 9,
          "bossHp": 1317646,
          "bossAttack": 0,
          "defense": 0,
          "strikeDamage": 0
        },
        {
          "stage": 10,
          "bossHp": 3381738,
          "bossAttack": 0,
          "defense": 0,
          "strikeDamage": 0
        }
      ]
    },
    {
      "bossType": "ARMORED",
      "stages": [
        {
          "stage": 1,
          "bossHp": 22194,
          "bossAttack": 0,
          "defense": 513,
          "strikeDamage": 0
        },
        {
          "stage": 2,
          "bossHp": 33216,
          "bossAttack": 0,
          "defense": 621,
          "strikeDamage": 0
        },
        {
          "stage": 3,
          "bossHp": 44548,
          "bossAttack": 0,
          "defense": 681,
          "strikeDamage": 0
        },
        {
          "stage": 4,
          "bossHp": 63960,
          "bossAttack": 0,
          "defense": 747,
          "strikeDamage": 0
        },
        {
          "stage": 5,
          "bossHp": 100494,
          "bossAttack": 0,
          "defense": 861,
          "strikeDamage": 0
        },
        {
          "stage": 6,
          "bossHp": 137924,
          "bossAttack": 0,
          "defense": 921,
          "strikeDamage": 0
        },
        {
          "stage": 7,
          "bossHp": 190356,
          "bossAttack": 0,
          "defense": 987,
          "strikeDamage": 0
        },
        {
          "stage": 8,
          "bossHp": 318444,
          "bossAttack": 0,
          "defense": 1113,
          "strikeDamage": 0
        },
        {
          "stage": 9,
          "bossHp": 610562,
          "bossAttack": 0,
          "defense": 1353,
          "strikeDamage": 0
        },
        {
          "stage": 10,
          "bossHp": 1567030,
          "bossAttack": 0,
          "defense": 1653,
          "strikeDamage": 0
        }
      ]
    }
  ]
}
